{
  "$schema": "http://json-schema.org/draft-07/schema#",
  "$id": "https://raw.githubusercontent.com/kumin-consulting/nextos-community-tools/main/schema/tool.schema.json",
  "title": "NextOS community tool",
  "description": "One community tool: what NextOS needs to install or run it, plus what its public page at https://www.jonkum.in/community/<slug> needs to be found and read.",
  "type": "object",
  "additionalProperties": false,
  "required": ["slug", "name", "kind", "summary", "version", "author", "repository", "license", "publishedAt", "updatedAt", "categories", "install"],
  "properties": {
    "slug": { "type": "string", "pattern": "^[a-z0-9]+(?:-[a-z0-9]+)*$", "minLength": 2, "maxLength": 64, "description": "The page address segment and the folder name. Lowercase letters, digits, single hyphens." },
    "name": { "type": "string", "minLength": 2, "maxLength": 60, "description": "The tool's name as people say it." },
    "kind": { "type": "string", "enum": ["app", "agent", "skill", "mcp-server", "cli", "template", "department", "integration", "skin"], "description": "What kind of thing this is inside NextOS. A \"skin\" also needs skin/skin.json and images/preview.svg in its folder." },
    "summary": { "type": "string", "minLength": 60, "maxLength": 160, "description": "One plain sentence: the meta description and the listing card." },
    "version": { "type": "string", "minLength": 1, "maxLength": 32 },
    "author": {
      "type": "object", "additionalProperties": false, "required": ["name"],
      "properties": { "name": { "type": "string", "minLength": 1, "maxLength": 80 }, "url": { "type": "string", "format": "uri", "pattern": "^https://" } }
    },
    "repository": { "type": "string", "format": "uri", "pattern": "^https://", "description": "Where the source lives." },
    "homepage": { "type": "string", "format": "uri", "pattern": "^https://" },
    "license": { "type": "string", "minLength": 1, "maxLength": 40, "description": "An SPDX identifier where one exists (MIT, Apache-2.0, ...)." },
    "publishedAt": { "type": "string", "format": "date", "description": "YYYY-MM-DD, the day the tool first appeared here." },
    "updatedAt": { "type": "string", "format": "date", "description": "YYYY-MM-DD, bumped whenever the tool or its page changes. Drives the sitemap." },
    "categories": { "type": "array", "minItems": 1, "maxItems": 3, "uniqueItems": true, "items": { "type": "string", "enum": ["productivity", "developer-tools", "agents", "automation", "data", "communication", "media", "business", "sites", "infrastructure", "security", "fun", "design"] } },
    "tags": { "type": "array", "maxItems": 12, "uniqueItems": true, "items": { "type": "string", "pattern": "^[a-z0-9]+(?:-[a-z0-9]+)*$", "maxLength": 32 } },
    "seo": {
      "type": "object", "additionalProperties": false,
      "properties": {
        "title": { "type": "string", "minLength": 10, "maxLength": 60, "description": "Search result and tab title. Defaults to '<name> - <summary>' trimmed." },
        "description": { "type": "string", "minLength": 60, "maxLength": 160, "description": "Overrides summary as the meta description." },
        "keywords": { "type": "array", "maxItems": 15, "uniqueItems": true, "items": { "type": "string", "minLength": 2, "maxLength": 40 } },
        "ogImage": { "type": "string", "description": "1200x630 share image: a path under this tool's folder or an https URL." }
      }
    },
    "screenshots": {
      "type": "array", "maxItems": 8,
      "items": { "type": "object", "additionalProperties": false, "required": ["src", "alt"], "properties": { "src": { "type": "string", "minLength": 1 }, "alt": { "type": "string", "minLength": 8, "maxLength": 160 }, "caption": { "type": "string", "maxLength": 200 } } }
    },
    "faq": {
      "type": "array", "maxItems": 10,
      "items": { "type": "object", "additionalProperties": false, "required": ["q", "a"], "properties": { "q": { "type": "string", "minLength": 8, "maxLength": 160 }, "a": { "type": "string", "minLength": 20, "maxLength": 1000 } } }
    },
    "install": {
      "type": "object", "additionalProperties": false, "required": ["kind"],
      "properties": {
        "kind": { "type": "string", "enum": ["command", "url", "steps", "app-store", "skin"] },
        "command": { "type": "string", "maxLength": 300, "description": "For kind 'command': the one line to run." },
        "url": { "type": "string", "format": "uri", "pattern": "^https://", "description": "For kind 'url': where to get it." },
        "steps": { "type": "array", "minItems": 1, "maxItems": 10, "items": { "type": "string", "minLength": 4, "maxLength": 300 } },
        "appId": { "type": "string", "pattern": "^[a-z0-9]+(?:-[a-z0-9]+)*$", "description": "For kind 'app-store': the catalogue app id." }
      }
    },
    "requires": {
      "type": "object", "additionalProperties": false,
      "properties": {
        "nextos": { "type": "string", "maxLength": 32, "description": "Minimum NextOS version or feature, in words." },
        "platforms": { "type": "array", "uniqueItems": true, "items": { "type": "string", "enum": ["web", "macos", "windows", "linux", "ios", "android"] } },
        "accounts": { "type": "array", "uniqueItems": true, "items": { "type": "string", "maxLength": 40 }, "description": "Third-party accounts or keys the tool needs." }
      }
    },
    "permissions": { "type": "array", "uniqueItems": true, "items": { "type": "string", "maxLength": 60 }, "description": "For apps: the NextOS app permissions it asks for, verbatim." },
    "related": { "type": "array", "maxItems": 6, "uniqueItems": true, "items": { "type": "string", "pattern": "^[a-z0-9]+(?:-[a-z0-9]+)*$" }, "description": "Slugs of other community tools worth showing next to this one." },
    "support": {
      "type": "object", "additionalProperties": false,
      "properties": { "issues": { "type": "string", "format": "uri", "pattern": "^https://" }, "discussions": { "type": "string", "format": "uri", "pattern": "^https://" }, "email": { "type": "string", "format": "email" } }
    }
  }
}
